{
    "addresses": [
        {
            "city": "Any City",
            "country": "US",
            "id": "some_456_id",
            "postalCode": "11111",
            "streetName": "Any Street",
            "streetNumber": "1337"
        }
    ],
    "email": "1-<random>@example.com",
    "firstName": "Jane",
    "id": "some_123_id",
    "isEmailVerified": false,
    "lastName": "Doe",
    "password": "secret123",
    "version": 4,
    "createdAt": "2015-05-06T12:10:12.421Z",
    "lastModifiedAt": "2015-07-06T13:22:33.339Z"
}
